{
  "version": "1.0",
  "kind": "tilemap_mapping",
  "source_blueprint": "tilemap_blueprint.json",
  "source_candidates": "tile_candidates.json",
  "map_size": [
    16,
    16
  ],
  "tile_size": [
    64,
    64
  ],
  "tile_ids": {
    "campus_lawn_center": 1,
    "plaza_corner_top_left_tile": 2,
    "plaza_edge_top_tile": 3,
    "plaza_corner_top_right_tile": 4,
    "plaza_edge_left_tile": 5,
    "plaza_center_tile": 6,
    "plaza_variant_tile": 7,
    "plaza_edge_right_tile": 8,
    "plaza_corner_bottom_left_tile": 9,
    "plaza_edge_bottom_tile": 10,
    "plaza_corner_bottom_right_tile": 11,
    "walkway_edge_left_tile": 12,
    "walkway_center_tile": 13,
    "walkway_edge_right_tile": 14,
    "walkway_edge_top_tile": 15,
    "walkway_edge_bottom_tile": 16
  },
  "assignments": [
    {
      "x": 0,
      "y": 0,
      "layer": "terrain",
      "material": "campus_lawn",
      "role": "center",
      "candidate_id": "campus_lawn_center",
      "gid": 1
    },
    {
      "x": 1,
      "y": 0,
      "layer": "terrain",
      "material": "campus_lawn",
      "role": "center",
      "candidate_id": "campus_lawn_center",
      "gid": 1
    },
    {
      "x": 2,
      "y": 0,
      "layer": "terrain",
      "material": "campus_lawn",
      "role": "center",
      "candidate_id": "campus_lawn_center",
      "gid": 1
    },
    {
      "x": 3,
      "y": 0,
      "layer": "terrain",
      "material": "campus_lawn",
      "role": "center",
      "candidate_id": "campus_lawn_center",
      "gid": 1
    },
    {
      "x": 4,
      "y": 0,
      "layer": "terrain",
      "material": "campus_lawn",
      "role": "center",
      "candidate_id": "campus_lawn_center",
      "gid": 1
    },
    {
      "x": 5,
      "y": 0,
      "layer": "terrain",
      "material": "campus_lawn",
      "role": "center",
      "candidate_id": "campus_lawn_center",
      "gid": 1
    },
    {
      "x": 6,
      "y": 0,
      "layer": "terrain",
      "material": "campus_lawn",
      "role": "center",
      "candidate_id": "campus_lawn_center",
      "gid": 1
    },
    {
      "x": 7,
      "y": 0,
      "layer": "terrain",
      "material": "campus_lawn",
      "role": "center",
      "candidate_id": "campus_lawn_center",
      "gid": 1
    },
    {
      "x": 8,
      "y": 0,
      "layer": "terrain",
      "material": "campus_lawn",
      "role": "center",
      "candidate_id": "campus_lawn_center",
      "gid": 1
    },
    {
      "x": 9,
      "y": 0,
      "layer": "terrain",
      "material": "campus_lawn",
      "role": "center",
      "candidate_id": "campus_lawn_center",
      "gid": 1
    },
    {
      "x": 10,
      "y": 0,
      "layer": "terrain",
      "material": "campus_lawn",
      "role": "center",
      "candidate_id": "campus_lawn_center",
      "gid": 1
    },
    {
      "x": 11,
      "y": 0,
      "layer": "terrain",
      "material": "campus_lawn",
      "role": "center",
      "candidate_id": "campus_lawn_center",
      "gid": 1
    },
    {
      "x": 12,
      "y": 0,
      "layer": "terrain",
      "material": "campus_lawn",
      "role": "center",
      "candidate_id": "campus_lawn_center",
      "gid": 1
    },
    {
      "x": 13,
      "y": 0,
      "layer": "terrain",
      "material": "campus_lawn",
      "role": "center",
      "candidate_id": "campus_lawn_center",
      "gid": 1
    },
    {
      "x": 14,
      "y": 0,
      "layer": "terrain",
      "material": "campus_lawn",
      "role": "center",
      "candidate_id": "campus_lawn_center",
      "gid": 1
    },
    {
      "x": 15,
      "y": 0,
      "layer": "terrain",
      "material": "campus_lawn",
      "role": "center",
      "candidate_id": "campus_lawn_center",
      "gid": 1
    },
    {
      "x": 0,
      "y": 1,
      "layer": "terrain",
      "material": "campus_lawn",
      "role": "center",
      "candidate_id": "campus_lawn_center",
      "gid": 1
    },
    {
      "x": 1,
      "y": 1,
      "layer": "terrain",
      "material": "campus_lawn",
      "role": "center",
      "candidate_id": "campus_lawn_center",
      "gid": 1
    },
    {
      "x": 2,
      "y": 1,
      "layer": "terrain",
      "material": "campus_lawn",
      "role": "center",
      "candidate_id": "campus_lawn_center",
      "gid": 1
    },
    {
      "x": 3,
      "y": 1,
      "layer": "terrain",
      "material": "campus_lawn",
      "role": "center",
      "candidate_id": "campus_lawn_center",
      "gid": 1
    },
    {
      "x": 4,
      "y": 1,
      "layer": "terrain",
      "material": "campus_lawn",
      "role": "center",
      "candidate_id": "campus_lawn_center",
      "gid": 1
    },
    {
      "x": 5,
      "y": 1,
      "layer": "terrain",
      "material": "campus_lawn",
      "role": "center",
      "candidate_id": "campus_lawn_center",
      "gid": 1
    },
    {
      "x": 6,
      "y": 1,
      "layer": "terrain",
      "material": "campus_lawn",
      "role": "center",
      "candidate_id": "campus_lawn_center",
      "gid": 1
    },
    {
      "x": 7,
      "y": 1,
      "layer": "terrain",
      "material": "campus_lawn",
      "role": "center",
      "candidate_id": "campus_lawn_center",
      "gid": 1
    },
    {
      "x": 8,
      "y": 1,
      "layer": "terrain",
      "material": "campus_lawn",
      "role": "center",
      "candidate_id": "campus_lawn_center",
      "gid": 1
    },
    {
      "x": 9,
      "y": 1,
      "layer": "terrain",
      "material": "campus_lawn",
      "role": "center",
      "candidate_id": "campus_lawn_center",
      "gid": 1
    },
    {
      "x": 10,
      "y": 1,
      "layer": "terrain",
      "material": "campus_lawn",
      "role": "center",
      "candidate_id": "campus_lawn_center",
      "gid": 1
    },
    {
      "x": 11,
      "y": 1,
      "layer": "terrain",
      "material": "campus_lawn",
      "role": "center",
      "candidate_id": "campus_lawn_center",
      "gid": 1
    },
    {
      "x": 12,
      "y": 1,
      "layer": "terrain",
      "material": "campus_lawn",
      "role": "center",
      "candidate_id": "campus_lawn_center",
      "gid": 1
    },
    {
      "x": 13,
      "y": 1,
      "layer": "terrain",
      "material": "campus_lawn",
      "role": "center",
      "candidate_id": "campus_lawn_center",
      "gid": 1
    },
    {
      "x": 14,
      "y": 1,
      "layer": "terrain",
      "material": "campus_lawn",
      "role": "center",
      "candidate_id": "campus_lawn_center",
      "gid": 1
    },
    {
      "x": 15,
      "y": 1,
      "layer": "terrain",
      "material": "campus_lawn",
      "role": "center",
      "candidate_id": "campus_lawn_center",
      "gid": 1
    },
    {
      "x": 0,
      "y": 2,
      "layer": "terrain",
      "material": "campus_lawn",
      "role": "center",
      "candidate_id": "campus_lawn_center",
      "gid": 1
    },
    {
      "x": 1,
      "y": 2,
      "layer": "terrain",
      "material": "campus_lawn",
      "role": "center",
      "candidate_id": "campus_lawn_center",
      "gid": 1
    },
    {
      "x": 2,
      "y": 2,
      "layer": "terrain",
      "material": "campus_lawn",
      "role": "center",
      "candidate_id": "campus_lawn_center",
      "gid": 1
    },
    {
      "x": 3,
      "y": 2,
      "layer": "terrain",
      "material": "campus_lawn",
      "role": "center",
      "candidate_id": "campus_lawn_center",
      "gid": 1
    },
    {
      "x": 4,
      "y": 2,
      "layer": "terrain",
      "material": "campus_lawn",
      "role": "center",
      "candidate_id": "campus_lawn_center",
      "gid": 1
    },
    {
      "x": 5,
      "y": 2,
      "layer": "terrain",
      "material": "campus_lawn",
      "role": "center",
      "candidate_id": "campus_lawn_center",
      "gid": 1
    },
    {
      "x": 6,
      "y": 2,
      "layer": "terrain",
      "material": "campus_lawn",
      "role": "center",
      "candidate_id": "campus_lawn_center",
      "gid": 1
    },
    {
      "x": 7,
      "y": 2,
      "layer": "terrain",
      "material": "campus_lawn",
      "role": "center",
      "candidate_id": "campus_lawn_center",
      "gid": 1
    },
    {
      "x": 8,
      "y": 2,
      "layer": "terrain",
      "material": "campus_lawn",
      "role": "center",
      "candidate_id": "campus_lawn_center",
      "gid": 1
    },
    {
      "x": 9,
      "y": 2,
      "layer": "terrain",
      "material": "campus_lawn",
      "role": "center",
      "candidate_id": "campus_lawn_center",
      "gid": 1
    },
    {
      "x": 10,
      "y": 2,
      "layer": "terrain",
      "material": "campus_lawn",
      "role": "center",
      "candidate_id": "campus_lawn_center",
      "gid": 1
    },
    {
      "x": 11,
      "y": 2,
      "layer": "terrain",
      "material": "campus_lawn",
      "role": "center",
      "candidate_id": "campus_lawn_center",
      "gid": 1
    },
    {
      "x": 12,
      "y": 2,
      "layer": "terrain",
      "material": "campus_lawn",
      "role": "center",
      "candidate_id": "campus_lawn_center",
      "gid": 1
    },
    {
      "x": 13,
      "y": 2,
      "layer": "terrain",
      "material": "campus_lawn",
      "role": "center",
      "candidate_id": "campus_lawn_center",
      "gid": 1
    },
    {
      "x": 14,
      "y": 2,
      "layer": "terrain",
      "material": "campus_lawn",
      "role": "center",
      "candidate_id": "campus_lawn_center",
      "gid": 1
    },
    {
      "x": 15,
      "y": 2,
      "layer": "terrain",
      "material": "campus_lawn",
      "role": "center",
      "candidate_id": "campus_lawn_center",
      "gid": 1
    },
    {
      "x": 0,
      "y": 3,
      "layer": "terrain",
      "material": "campus_lawn",
      "role": "center",
      "candidate_id": "campus_lawn_center",
      "gid": 1
    },
    {
      "x": 1,
      "y": 3,
      "layer": "terrain",
      "material": "campus_lawn",
      "role": "center",
      "candidate_id": "campus_lawn_center",
      "gid": 1
    },
    {
      "x": 2,
      "y": 3,